"fileName","title","authors","firstAuthor","altAuthors","session","firstPage","lastPage","procYear","abstract"
"2009002005","Prototype ALMA Band 5 Cartridge: Design and Performance","V. Belitsky, I. Lapkin, B. Billade, E. Sundin, A. Pavolotsky, D. Meledin, V. Desmaris, M. Strandberg, R. Finger, O. Nyström, M. Fredrixon, S.E. Ferm, H. Rashid, and D. Henke","Belitsky","Nystroem, Nystrom","M1","2","5","2009","The Atacama Large Millimeter/submillimeter Array (ALMA), an international astronomy facility, is a partnership of East Asia, Europe and North America in cooperation with the Republic of Chile and aims to build an interferometer radio telescope consisting of more than 60 antennas. The instrument is under construction at the Llano de Chajnantor, about 50 km east of San Pedro de Atacama, Chile. This work presents a part of ALMA frontend, the development, design and performance of one of the frequency channels of the ALMA receiver, the Band 5 prototype cartridge for 163 - 211 GHz frequency band."
"2009006000","Evaluation of ALMA Band 8 S/N01 Cartridge","Y. Sekimoto, Y. Iizuka, T. Ito, K. Kumagai, N. Satou, M. Kamikura, Y. Serizawa, N. Naruse, Y. Niizeki, Y. Fujimoto, and W. L. Shan","Sekimoto",NULL,"M1","6","0","2009","ALMA Band 8 (385 - 500 GHz) is one of frequency bands which cover atmospheric windows on the Atacama desert in the northern Chile. We have developed a cartridge-type receiver which receives two orthogonal polarizations and down-converts the sideband separated signals to intermediate frequencies (IF) between 4 and 8 Wiz. A vvaveguide polarization splitter or ortho-mode transducer (OMT) has been developed, which enables the cryogenic optics quite simple. It achieved low loss of-O.4 dB at 4 K and polarization isolation of -25 dB in 385 - 500 GHz [1]. A sideband separating mixer consists of two DSB Nb-based SIS mixers and vvaveguide quadrature coupler [2]. The receiver noise temperature was less than 8 hf/k or 196 K in SSl3 and the image rejection ratio of > 10 dB in the 90 % of ALMA Band 8 frequency. Gain compression of this receiver was measured. The amplitude and phase stabilities were confirmed to comply the ALMA specifications. The co-polar and cross polar beam patterns of this receiver were measured in five frequencies [3]. Test results of S/N 01 cartridge will be presented."
"2009007011","Series Production of State-of-the-Art 602-720 GHz SIS Receivers for Band 9 of ALMA","B. D. Jackson, R. Hesper, J. Adema, J. Barkhof, A. M. Baryshev,T. Zijlstra, S. Zhu, and T. M. Klapwijk","Jackson",NULL,"M1","7","11","2009","The Atacama Large Millimeter/Sub-millimeter Array (ALMA) requires the development and production of 73
state-of-the-art receivers for the 602-720 GHz range - the ALMA Band 9 cartridges. Development and pre-production of the first 8 cartridges was completed between 2003 and 2008, resulting in a cartridge design that meets the project's challenging requirements. The cartridge design remains essentially unchanged for production, while the production and test processes developed during pre-production have been fine-tuned to address the biggest new challenge for this phase - ramping up production to a rate of 2 cartridges per month over 2009-2012."
"2009012000","Development of the 787-950 GHz ALMA Band 10 Cartridge","Y. Uzawa, T. Kojima1, M. Kroug, M. Takeda, M. Candotti, Y. Fujii, W.-L. Shan, K. Kaneko, S.Shitov, and M.-J. Wang","Uzawa",NULL,"M1","12","0","2009","We are developing the Atacama Large Millimeter/Submillimeter Array (ALMA) Band 10 (787-950 GHz) receiver cartridge. The incoming beam from the 12-m antenna is reflected by a pair of two ellipsoidal mirrors placed in the cartridge, and then split into two orthogonal polarizations by a free-standing wire-grid. Each beam enters a corrugated feed horn attached to a double-side-band (DSB) mixer block. The mixer uses a full-height waveguide and an NbTiN- or NbN-based superconductor-insulator-superconductor (SIS) mixer chip. We are testing the following three types of mixer chips: 1) Nb SIS junctions + NbTiN/SiO2/Al tuning circuits on a quartz substrate, 2) Nb SIS junctions + NbN/SiO2/Al tuning circuits on an MgO substrate, and 3) NbN SIS junctions + NbN or NbTiN tuning circuits on an MgO substrate. The IF system uses a 4-12-GHz cooled low-noise InP-based MMIC amplifier developed by Caltech. So far, the type 1) has shown the best performance. At LO frequencies from 800 to 940 GHz, the mixer noise temperatures measured by using the standard Y-factor method were below 240 K at an operating physical temperature of 4 K. The lowest noise temperature, 169 K, was obtained at the center frequency of the band 10, as designed. These well-developed technologies will be implemented in the band 10 cartridge to achieve the ALMA specifications."
"2009014018","230 GHz sideband-separating mixer array","Doris Maier","Maier",NULL,"M2","14","18","2009","Since 2001 the Heterodyne Receiver Array, HERA, is installed at IRAM's 30m telescope in Spain. It consists of two arrays with 3x3 pixels for two orthogonal polarizations. The receiver is equipped with SSB backshort mixers covering an RF frequency range from 218 to 267 GHz with an IF band of 3.5 to 4.5 GHz. In the near future IRAM will replace this receiver by a new dual-polarization multi-beam receiver with 7x7 pixels. The receiver will be equipped with sideband-separating mixers covering an RF frequency range from 200 to 280 GHz with an IF band from 4 to 12 GHz. The RF quadrature couplers as well as the LO couplers will be realized as branchguide couplers and be integrated with the mixer blocks into one E-plane split-block. The DSB mixers will use Nb junction technology and the IF couplers will be custom made for the use at cryogenic temperatures. This paper presents the concept of the new array as well as the designs of the DSB mixers and the different couplers."
"2009019023","ALMA Band 5 (163-211 GHz) Sideband Separation Mixer","Bhushan Billade, Victor Belitsky, Alexey Pavolotsky, Igor Lapkin, and Jacob Kooi","Billade",NULL,"M2","19","23","2009","We present the design of ALMA Band 5 sideband separation SIS mixer and experimental results for the double side band mixer and first measurement results 2SB mixer. In this mixer, the LO injection circuitry is integrated on the mixer substrate using a directional coupler, combining microstrip lines with slot-line branches in the ground plane. The isolated port of the LO coupler is terminated by wideband floating elliptical termination. The mixer employs two SIS junctions with junction area of 3 micro m2 each, in the twin junction configuration, followed by a quarter wave transformer to match the RF probe. 2SB mixer uses two identical but mirrored chips, whereas each DSB mixer has the same end-piece configuration. The 2S mixer has modular design such that DSB mixers are measured independently and then integrated into 2SB simply by placing around the middle piece. Measurements of the DSB mixer show noise temperature of around 40K over the entire band. 2SB mixer is not fully characterized yet, however, preliminary measurement indicates SSB (un-corrected) noise temperature of 80K."
"2009024030","Development of SIS Mixers for SMA 400-520 GHz Band","Chao-Te Li, Tse-Jun Chen, Tong-Liang Ni, Wei-Chun Lu, Chuang-Ping Chiu, Chong-Wen Chen, Yung-Chin Chang, Ming-Jye Wang, and Sheng-Cai Shi","Li",NULL,"M2","24","30","2009","SIS junction mixers were developed for SMA 400-520 GHz band. The results show receiver noise temperature around 100 K across the band, with noise contribution from RF loss and IF estimated to be around 50 K and 20K, respectively. Two schemes were used to tune out junction's parasitic capacitance. When a parallel inductor is employed, the input impedance is close to Rn, which facilitates impedance matching between the junction and the waveguide probe. Waveguide probes were designed to achieve a low feed-point impedance to match to the junction resistance. Optimum embedding impedances for lower receiver noise temperature were investigated. Performances of two schemes and composition of receiver noise were also discussed."
"2009031034","An 800 GHz SIS Receiver for the RLT Incorporating a HIFI Band 3-type Mixer and SiGe LNA","A. Hedden, H. Li, E. Tong, S. Paine, R. Blundell, J. Kawamura, C. Groppi, C. Kulesa, C. Walker, G. de Lange, T. Klapwijk, T. Zijlstra, H. Mani, and S. Weinreb","Hedden",NULL,"M2","31","34","2009","We have constructed an 810 GHz receiver system incorporating a superconductor-insulator-superconductor (SIS) mixer developed for Band-3 of the HIFI instrument for Herschel space observatory and a wide-band SiGe low noise amplifier (LNA) designed at Caltech. The instrument is currently installed at the RLT telescope (elevation 5500 m) in northern Chile. Hot/cold (280K/72K) load measurements performed at the telescope yield noise temperatures of 225 K (Y-factor = 1.7) including receiver optics. First-light observations indicate that the receiver is highly sensitive and functions stably. We present details of the receiver system, its performance at the telescope, and first-light observations with the Herschel mixer."
"2009035000","Broadband SIS mixer for 1 THz Band","A. Karpov, D. Miller, J. A. Stern, B. Bumble, H. G. LeDuc, J. Zmuidzinas","Karpov",NULL,"M2","35","0","2009","We report the development of a low noise and broadband SIS mixer aimed for 1 THz channel of the Caltech Airborne Submillimeter Interstellar Medium Investigations Receiver (CASIMIR), designed for the Stratospheric Observatory for Far Infrared Astronomy, (SOFIA). The mixer uses an array of 0.24 micro m2 Nb/Al-AlN/NbTiN SIS junctions with critical current density of 30-50 KA/cm2. The junctions are shaped in order to optimize the suppression of the Josephson DC currents. We are using a double slot planar antenna to couple the mixer chip with the telescope beam. The RF matching microcircuit is made using Nb and gold films. The mixer IF circuit is designed to cover 4 - 8 GHz band. A test receiver with the new mixer has a low noise operation in a 0.87 - 1.12 THz band. The minimum DSB receiver noise measured at 1 THz is 260 K (Y=1.64), apparently the lowest reported up to date. The receiver noise corrected for the loss in the LO injection beam splitter and in the cryostat window is 200 K. The combination of a broad operation band of about 250 GHz with a low receiver noise is making the new mixer a useful element for application at SOFIA. We will discuss the prospective of a further improvement of the sensitivity and extension of the upper frequency of operation of SIS mixer."
"2009037000","Terahertz Local Oscillator Sources","T.W. Crowe, J.L. Hesler, W.L. Bishop, G.S. Schoenthal, and K. Hui","Crowe",NULL,"M3","37","0","2009","High quality local oscillator sources are required for astronomical receivers throughout the terahertz frequency range. This paper is focused on the development of sources for frequencies greater than 1 THz for use with Hot Electron Bolometric (HEB) mixers, specifically on the Stratospheric Observatory For Infrared Astronomy (SOFIA). One of the great advantages of HEB mixers is their very low LO power requirements, of order one microwatt per pixel (including coupling losses). However, the challenges of achieving even this power level at such high frequency remain significant, and the goals for significant tuning bands to enhance the measurement capability of the receiver are formidable. Also, there is great interest in developing array receivers, which will increase the required power level by a factor of ten. VDI's terahertz sources are based on high power amplifiers, typically near 40GHz, and a series of frequency multipliers that translate the power to higher frequency, albeit with very significant losses. For example, three years ago VDI (in collaboration with SRON) presented a 1.3THz source that generated of order 10uW and was electronically tunable over 100GHz of bandwidth. This source used an amp/x2x2x3x3 configuration, where the doublers were high power varactors and the triplers were broadband varistor multipliers. In fact, the triplers were shown to operate with similar performance across the entire waveguide band (1.1-1.7THz) without any tuning whatsoever. These same triplers have been used to generate greater than 30uW, when stronger driver components have been used. More recently VDI has focused on the 1.9 and 2.7THz bands that are of interest for the German Receiver for Astronomy at Terahertz Frequencies, which is being developed by the Max-Planck-Institut fuer Radioastronomie (MPIfR) and the Universitaet zu Koeln for use on the SOFIA aircraft. At 1.9 THz VDI has delivered an initial LO chain that generates a few microwatts of power, which is marginally sufficient to pump the receiver when the coupling losses into the dewar are included. In this paper VDI will describe this LO chain and the ongoing efforts to increase the output power by an order of magnitude for use on a future receiver array. The 2.7 THz frequency band is significantly more challenging, owing to the increased inefficiency of Schottky multipliers at the higher frequency. The goal is to generate enough power for a single pixel receiver with significant frequency tuning. To date VDI has demonstrated the required driver module at 300GHz and is presently working on an improved tripler to 900GHz. The final tripler to 2.7THz has been designed and is awaiting fabrication. First results for the new components are expected to be available in time for the conference presentation."
"2009038000","Tunable THz Source with Harmonic Multiplier Based on Superlattice Structures","V.L.Vaks, A.N.Panin, S.I.Pripolzin, D.G.Paveliev, and U.I.Koshurinov","Vaks",NULL,"M3","38","0","2009","The traditional approach to obtain high-stable generators has involved frequency multiplication of high-stable reference synthesizers. The Schottky diodes are widely employed for developing of multipliers, mixers and detectors of THz  frequency range. However, for a successful operation in the THz region, it is necessary to increase cutoff frequency of Schottky diodes that has proven quite difficult due to fundamental restrictions (high inertness of electron pass through an active zone and parasitic capacitances). Use of superlattice structures are expected to be more effective for frequency transformation since the lower values of inertness and parasitic capacitances and presence of negative differential conductivity (up to 1 THz) on the volt-ampere characteristic. In the report we present high stable tunable radiation sources (frequency synthesizers and generator of harmonics), operating up to 6.3 THz. It is based on solid-state Gunn generator (97.5-117.5 GHz) and frequency multiplier on superlattice structures. Spectral parameters of generated harmonics are investigated. The elaborated source was used in THz spectrometer."
"2009039042","Terahertz Sideband Generator Array on Extended Silicon Dielectric Lens","Haiyong Xu, Sami H. Hawasli, Lei Liu, Jeffrey L. Hesler, and Robert M. Weikle, II","Xu",NULL,"M3","39","42","2009","Terahertz Sideband generator (SBG) array on an extended Silicon (Si) hemisphere lens has been investigated in this paper. High power handling capacity is achieved compared with single varactor waveguide design. The SBG array is fabricated on a GaAs substrate. The unit cell dimension is determined to be 40 microns x 40 microns with considering of only single Transverse Electromagnetic (TEM) mode propagation. Schottky planar varactor diode parameters have been chosen to match the optimized embedding impedance. The simulated diode anode diameter is 1 micron, and the finger length is 14 microns."
"2009043046","Diamond Heat-Spreaders for Submillimeter-Wave GaAs Schottky Diode Frequency Multipliers","Choonsup Lee, John Ward, Robert Lin, Erich Schlecht, Goutam Chattopadhyay, John Gill, Bertrand Thomas, Alain Maestrini, Imran Mehdi, and Peter Siegel","Lee",NULL,"M3","43","46","2009","We have attached CVD diamond film as a heatspreader to our existing 250 GHz GaAs Schottky diode frequency tripler chip in o rder to improve its power handling capability. Using this first generation device, we were able to produce 40 mW at 240 GHz from a single frequency tripler with 350 mW input power at room temperature. We have also run finite-element thermal simulations and seen that the 30 micron thick diamond film dropped the temperature of the anodes by about 200 degrees C. This break-through in thermal management increases the output power of frequency multipliers by nearly 100%."
"2009048000","Integration of Lithographically Microfabricated Rectangular Waveguides and THz Quantum Cascade Lasers","M.C. Wanke, C.D. Nordquist, M. Lee, C.L. Arrington, A.M. Rowen, M.J. Cich, A.D. Grine, C.T. Fuller, E.A. Shaner, E.W. Young, and J.L. Reno","Wanke",NULL,"M4","48","0","2009","THz quantum cascade lasers are promising solid-state sources for use as local-oscillators in THz heterodyne receiver systems. However, many challenges must still be addressed for QCLs to become practical THz sources. Among these challenges are to shape the highly divergent and non-Gaussian output beam patterns observed from QCLs into a more useful and predictable beam shape, and to integrate QCLs into the existing, broadly used THz technical infrastructure. To address both the beam pattern problem and integrability/manufacturability issues we have developed a lithographic method to microfabricate small, single mode rectangular waveguide structures on-a chip. To explore the performance of the waveguides as well as the integration with active THz lasers, we have tested both stand-alone waveguides and waveguides integrated on-chip with THz quantum cascade lasers. The 75 micron wide by 37 micron tall waveguide structures were designed to be single mode between 2 and 4 THz, and were fabricated using patterned electroplating of thick gold sidewalls around a photoresist form, followed by electroplating of a gold lid, and lastly removal of the polymer form by solvation. The waveguides were coupled to free space using 2-dimenstional H-plane horn flares. Measurements on stand-alone waveguides with different lengths revealed a loss of 1.4 +/- 0.15 dB/mm corresponding to 0.14 db/lambda. This is roughly a factor of two higher than HFSS models predict for perfect gold walls, but it still compares favorably to 0.2 db/lambda at 100 GHz and 0.6 db/lambda at 300 GHz for commercially available waveguides. Initial beam pattern measurements yielded qualitative data in agreement with predictions, but displayed strong high-spatial frequency amplitude oscillations. Recent measurements have identified the cause of this oscillation as being due to interference between alternate paths between the horn and detector resulting from reflections of intermediate optics. New beam pattern measurements eliminating the reflections will be presented. We have also successfully fabricated the rectangular waveguides directly onto a chip containing multiple THz QCLs. Even though thermal stress issues caused by the need to cool the lasers resulted in a high failure rate in initial designs, we have observed QCL emission from the horns of single-spatial-mode integrated waveguides, some using only 0.2 W of input power at threshold."
"2009049052","Phase-locking of a 2.7-THz Quantum Cascade Laser to a Microwave Reference","A.M. Baryshev, P. Khosropanah, W. Zhang, W. Jellema, J.N. Hovenier, J.R. Gao, T.M. Klapwijk, D.G. Paveliev, B.S. William, S. Kumar, Q. Hu, J.L. Reno, B. Klein, J.L. Hesler","Baryshev",NULL,"M4","49","52","2009","We demonstrate phase-locking of a 2.7-THz metal-metal waveguide quantum cascade laser (QCL) to an external microwave signal. The reference is the 15th harmonic, generated by a semiconductor superlattice nonlinear device, of a signal at 182 GHz, which itself is generated by a multiplier-chain (x2x3x2) from a microwave synthesizer at 15 GHz. Both laser and reference radiations are coupled into a hot electron bolometer mixer, resulting in a beat signal, which is fed into a phase-lock loop. Spectral analysis of the beat signal (see fig. 1) confirms that the QCL is phase locked. This result opens the possibility to extend heterodyne interferometers into the far-infrared range."
"2009054061","First 1.3 THz Observations at the APEX Telescope","C. Risacher, D. Meledin, V. Belitsky, and P. Bergman","Risacher",NULL,"T1","54","61","2009","The Atacama Pathfinder EXperiment (APEX) 12m telescope is operating on the Llano Chajnantor, Chile, since 2003 and a set of state of the art sub-millimeter receivers have been installed for frequencies spanning from 150 GHz to 1500 GHz. In 2008, a balanced 1.3 THz Hot Electron Bolometer (HEB) receiver was installed for the atmospheric window 1250-1380 GHz. This instrument is part of a 4-channel receiver cryostat with the other channels being 211-275 GHz, 275-370 GHz and 380-500 GHz Sideband Separating (SSB) SIS receivers. This paper presents the first observations obtained so far with the 1.3 THz band during its first months of operation. The sky measurements were taken during opportunistic commissioning and science verification phases, when the weather conditions were sufficiently good with a Precipitable Water Vapor (PWV) below 0.25 mm, which was the case only a few nights during these months. We present the first observations of the molecular transition CO J=(11-10) line on different sources such as Orion-FIR4, CW-Leo and SgrB2(M). We describe the many challenges and difficulties encountered for achieving successful THz observations from a large sub-millimeter ground-based telescope."
"2009062000","First Light of the TELIS instrument","Gert de Lange, Pavel Yagoubov, Hans Golstein, Arno de Lange, Bart van Kuik, Joris van Rantwijk, Ed de Vries, Johannes Dercksen, Ruud Hoogeveen, Valery Koshelets, Oleg Kiselev, and Andrey Ermakov","Lange",NULL,"T1","62","0","2009","The TELIS (Terahertz and sub-millimeter limb sounder) instrument is a three-channel heterodyne receiver developed for observations of the stratosphere. TELIS is mounted together with the MIPAS-B2 instrument on a balloon platform of the Institute for Meteorology and Climate Research of the University of Karlsruhe (IMK, Germany). TELIS can observe both in the sub-millimeter range (480-650 GHz) and at 1.8 THz, while MIPAS-B2 observes trace-gases in the thermal infrared. Results will be used to refine and constrain numerical chemical transport models. The SRON contribution to TELIS is the 480-650 GHz Superconducting Integrated Receiver (SIR) channel. This is a unique superconducting on-chip heterodyne receiver, consisting of a double dipole antenna, a SIS mixer, a flux-flow Local Oscillator, and a superconducting harmonic mixer used for phase locking of the LO-signal. The bandwidth of the Digital Autocorrelator IF-backend of the SIR-receiver channel is 2 GHz, centered at 6 GHz. The lowest noise temperature of the receiver is 120 K DSB, measured over the full IF bandwidth. Although the concept of an integrated receiver has been explored for some years, the actual use of such a receiver for scientific observations so far has not been demonstrated. The first flight campaign with TELIS/MIPAS was in June 2008 from Teresina (Brazil). The SIR channel was operating well during the 2 hour ascent, but a major problem with the TELIS cryostat occurred at flight altitude (40 km) and this prevented scientific data retrieval. A second flight of TELIS is scheduled early 2009 from Kiruna (Sweden). This flight will focus on the Arctic ozone chemistry. The actual flight date depends on the occurrence of favourable meterological conditions. In the presentation we will discuss the operation of the SIR-channel in the laboratory and at the Teresina campaign and may include the results of the Kiruna flight."
"2009063068","Performance of HIFI in Flight Conditions","Pieter Dieleman, David Teyssier, Thomas Klein, John C. Pearson, Willem Jellema, Jacob W. Kooi, Jonathan Braine, Pat. W. Morris, Albrecht R.W. de Jonge, Rob de Haan, Wouter. M. Laauwen, Heino P. Smit, Nick D. Whyborn, Peter R. Roelfsema, Frank P. Helmich, and Thijs W.M de Graauw, on behalf of the HIFI team.","Dieleman",NULL,"T1","63","68","2009","HIFI, the Heterodyne Instrument for the Far-Infrared is one of three instruments on board the ESA Herschel mission, planned for launch in May 2009. The HIFI instrument was tested in representative flight conditions during the Thermal Balance / Thermal Vacuum (TBTV) test in ESA's Large Space Simulator (LSS) last December 2008. In particular HIFI's local oscillator could finally be tested over its full frequency range. The system noise temperature is similar to that found during instrument testing at the laboratory. Stability is measured to be slightly worse for the SIS bands and better than before for the HEB mixers, the latter most likely due to the absence of vibrations of mechanical cryocoolers. A new diplexer calibration approach was used, LO purity tests around 930 and 1900 GHz to remove spurious signals were successfully performed. Standing waves in both the signal-and LO optical paths were measured to provide input for spectrum baselines optimization schemes."
