"fileName","title","authors","firstAuthor","altAuthors","session","firstPage","lastPage","procYear","abstract"
"2008292000","A modular 16-pixel terahertz imager system applying superconducting microbolometers and room temperature read-out electronics","M. Leivo, P. Helistö, A. Luukanen, J.S. Penttilä, T. Perälä, A. Rautiainen, H. Toivanen, C.R. Dietlein, and E.N. Grossman","Leivo","Helistoe, Helisto, Penttilae, Penttila, Peraelae, Perala","10","292","0","2008","Superconducting bolometers have long been used as the \"work horse\" technology for terahertz astrophysics. In this paper we describe a system developed for stand-off imaging of concealed weapons and explosives. The system utilizes an array of NbN antenna-coupled vacuum-bridge microbolometers as detectors. The detectors are modular, with 8 pixels incorporated within a single module. The modules are mounted onto the 2nd cooling stage of a commercial cryogen-free pulse tube refrigerator with a base temperature of ca. 4 K. The readout of the sensors is carried out with an innovative room-temperature feedback preamplifier that can achieve bolometer noise limited performance when operated at the \"inflexion point\" of the voltage-biased bolometer. In the paper we will describe the overall architecture of the modular system, describe the electrical and optical performance characteristics of the system, and show passive imagery of test objects acquired in the 200 GHz to 1 THz band. The system is a precursor for a video-rate imaging THz camera, which will be briefly discussed."
"2008293299","A novel heterodyne interferometer for millimetre and sub-millimetre astronomy","Paul K. Grimes, Matthew Brock, Christian M. Holler, Karl Jacobs, Michael E. Jones, Oliver G. King, Jamie Leech, Angela C. Taylor, and Ghassan Yassin","Grimes",NULL,"10","293","299","2008","We describe a novel heterodyne interferometer currently under construction at Oxford. The instrument employs new techniques in heterodyne interferometry, with the aim of achieving very high brightness sensitivity in the millimetre band. It is a single-baseline tracking interferometer for operation in the frequency range 185-275 GHz with two 0.4m offset parabolic antennas separated by a 0.5 m baseline. Each antenna feeds an SIS mixer with a 2-20 GHz IF band, driven by a phase-switched LO source. The IF signals from the mixers are processed by a 2-20 GHz analogue complex correlator. The primary science goal of this instrument is to measure the spectrum of the Sunyaev-Zel'dovich effect in galaxy clusters. In particular we intend to measure the frequency of the S-Z null near 217 GHz, which allows the gas temperature of the cluster to be  determined. Measuring the spectrum of the S-Z effect requires very high brightness sensitivity with moderate spatial and spectral resolution."
"2008300303","A 600 GHz Imaging Radar for Contraband Detection","Goutam Chattopadhyay, Ken B. Cooper, Robert Dengler, Tomas E. Bryllert, Erich Schlecht, Anders Skalare, Imran Mehdi, and Peter H. Siegel","Chattopadhyay",NULL,"10","300","303","2008","We have developed and demonstrated 3D imaging for contraband detection using a submillimeter-wave frequency modulated continuous wave (FMCW) radar with a fast microwave chirp and phase coherent detection. The technique provides an important advantage over more traditional CW RF imaging because of the ability to time-gate the return signals. This can be used to discern specific objects by greatly reducing clutter from unwanted targets or specular reflections. The prototype system uses a 600 GHz RF signal with a 28.8 GHz chirp producing a 2.3 MHz/micro seconds sweep yielding a range resolution of approximately 0.6 cm or less. Lateral resolution on the scene is set by a 40 cm diameter reflector producing approximately 0.5 cm at 4 m distance."
"2008304313","Experimental detection of terahertz radiation in bundles of single wall carbon nanotubes","K.S. Yngvesson, K. Fu, B. Fu, R. Zannoni, J. Nicholson, S.H. Adams, A. Ouarraoui, J. Donovan and E. Polizzi","Yngvesson",NULL,"11","304","313","2008","We present new data extending our previous paper at the ISSTT2006 on microwave detection in carbon nanotubes (CNTs). In particular, we derive a circuit model based on ANA measurements. We also demonstrate the first terahertz detection (up to 2.54 THz) in bundles of CNTs that were deposited through dielectrophoresis across the smallest gap in log-periodic antennas. Data are given that support the hypothesis that the detection process is bolometric at THz frequencies. Future extensions are planned that will employ suspended CNTs and explore heterodyne detection. Finally, we have performed unique ab initio simulations with the aim of comparing these with the experimental data."
"2008314318","An Empirical Probe to the Operation of SIS Receivers - Revisiting the Technique of Intersecting Lines","C.-Y. Edward Tong, Abby Hedden, and Ray Blundell","Tong",NULL,"11","314","318","2008","An alternate formulation is derived for the technique of intersecting lines which is a well established tool for the analysis of the performance of SIS receivers. This newer formulation is easier to use and provides an estimate of possible experimental error. The significance of the intersecting temperature, TX, is discussed. Our experiments suggest that both quantum noise and the input match of the SIS mixer contribute to the value of the intersecting temperature."
"2008319328","Short GaAs/AlAs superlattices as THz radiation sources","D.G. Paveliev, Yu.I. Koschurinov, V.M. Ustinov, A.E. Zhukov, F. Lewen, C. Endres, A.M. Baryshev, P. Khosropanah, Wen Zhang, K. F. Renk, B. I. Stahl, A. Semenov, and H.-W. Huebers","Paveliev","Hübers, Hubers","11","319","328","2008","Semi-conductor devices based on diodes with Schottky barrier are widely used in room temperature applications in the THz frequency range. However, application of Schottky barrier diodes in these frequencies is limited by several factors: long time of carrier passage through the barrier and relatively large specific capacity. Shorter times of the response and the smaller value of specific capacity can be achieved by creation of the diodes on the basis of semiconductor superlattices. For these diodes we have also minimized values of series resistance Rs and parasitic capacity Cpar of a substrate carrying the diode. An area of the active region of the diode was less 2x10-8 cm2. Measurement results of the output power level, efficiency and output harmonics content at room temperature are shown for the devices based on the new planar superlattice diodes for input frequency ranges 10-20 GHz, 78-118 GHz and 180-240 GHz. In this report the superlattice device applications as THz radiation sources are discussed."
"2008329338","A New Experimental Procedure for Determining the Response of Bolometric Detectors to Fields in Any State of Coherence","Christopher N. Thomas, Stafford Withington, and George Saklatvala","Thomas",NULL,"11","329","338","2008","Any bolometer that is greater than a few wavelengths in size is receptive to the power in a number of fully coherent optical modes simultaneously. Knowing the amplitude, phase, and polarisation patterns of these modes, and their relative sensitivities, is central to being able to use a multimode detector effectively. We describe a procedure for measuring the spatial state of coherence to which a detector is sensitive. Diagonalisation of the coherence function then gives the natural modes. The scheme is based on the result that the expectation value of the output of any detector, or indeed whole instrument or telescope, is given by the contraction of two tensor fields: one of which describes the state of coherence of the incoming radiation, and the other describes the state of coherence to which the detector is sensitive. It follows that if a detector is illuminated by two coherent point sources, in the near or far field, and the phase of one source rotated relative to the other, the output of the detector displays a fringe. By repeating the process with different source locations, the detector's coherence tensor can be reconstructed from the recorded complex visibilities. This new, powerful technique is essentially aperture synthesis interferometry in reverse, and therefore many of the data processing techniques developed in the context of astronomy can be used for characterising the optical behaviour of few-mode bolometers."
"2008339341","Silicon Micromachined Components at Terahertz Frequencies for Astrophysics and Planetary Applications","Goutam Chattopadhyay, John S. Ward, Harish Manohara, Risaku Toda, and Robert H. Lin","Chattopadhyay",NULL,"12","339","341","2008","At the Jet Propulsion Laboratory (JPL) we are using deep reactive ion etching (DRIE) based silicon micromachining to develop the critical waveguide components at submillimeter wavelengths that will lead to highly integrated multi-pixel spectrometers, imagers, and radars. The advantage of DRIE over wet anisotropic etching is that DRIE exhibits little crystal plane dependence and therefore reduces geometric restrictions. As a result, DRIE enables fabrication of trenches that are independent of crystal planes, thus making it possible to develop micromachined waveguides with vertical sidewall profiles. In this paper we describe the design and fabrication of silicon micromachined critical waveguide components operating in the range 325-500 GHz frequency band for astrophysics and planetary applications from space. We also address the challenges of testing these devices when interfaced with metal waveguide test fixtures."
"2008342345","Microfabrication Technology for All-Metal Sub-mm and THz Waveguide Receiver Components","Vincent Desmaris, Denis Meledin, Alexey Pavolotsky and Victor Belitsky","Desmaris",NULL,"12","342","345","2008","A novel technology for manufacturing of micromachined all-metal waveguide circuits and structures for the frequency band from 200 up to 7000 GHz (Sub-Millimeter and THz) is presented. The waveguide circuits are formed using metal electroplating with preceding sputtering of a thin metal film seed layer over a photo-lithographically patterned thick SU-8 photo-resist. The process provides possibility of making 3-dimensional structures via facilitating of multi-level (layered) designs. Surface roughness of the THz waveguide structure was demonstrated to be below 0.1 micron. This technology was used to build a state-of-the art waveguide balanced 1.3 THz Hot Electron Bolometer mixer and other application for radio astronomy instrumentation."
"2008346350","High performance smooth-walled feed horns for focal plane arrays","P. Kittara, J. Leech, G. Yassin, B.K. Tan, A. Jiralucksanawong, and S. Wangsuya","Kittara",NULL,"12","346","350","2008","We describe the design and testing of an easy-tomachine smooth-walled horn which exhibits excellent beam circularity and low cross polarisation over a relatively large bandwidth. The design comprises three coaxial conical sections and two flare discontinuities joining the three sections together. The discontinuities generate appropriate higher order modes which combine to give a circular field distribution at the aperture. The positions and sizes of these discontinuities were calculated using a genetic algorithm. The horn was fabricated either by using the well known electroforming method or simply by a drill tool, shaped into the horn profile, and a standard mill. The measured radiation patterns or the electroformed horns show good excellent circularity and agree well with the calculated curves. They also show that the three-section horn has a substantially wider bandwidth than the conventional Potter horn. Preliminary measurements of the drilled horns patterns are also shown and compared with theory."
"2008351357","Optics Design and Verification for the APEX Swedish Heterodyne Facility Instrument (SHeFI)","Igor Lapkin, Olle Nyström, Vincent Desmaris, Dimitar Dochev, Vessen Vassilev, Raquel Monje, Denis Meledin, Douglas Henke, Magnus Strandberg, Erik Sundin, Mathias Fredrixon, Sven-Erik Ferm, and V. Belitsky","Lapkin","Nystroem, Nystrom","12","351","357","2008","In this paper, we present the design and verification of the receiver optics for the Swedish Heterodyne Facility Instrument (SHeFI) of the APEX telescope. SHeFI is placed in the telescope Nasmyth cabin A (NCA). The receiver is designed to carry up to 6 frequency channels of which four receiver channels have been designed, built and characterized: 211-275 GHz (Band 1); 275-370 GHz (Band 2); 385-500 GHz (Band 3); 1250-1390 GHz (Band T2). Bands 1, 2, and T2 were installed in the telescope during Spring 2008 and are currently in operation. The first three bands use 2SB SIS mixer technology and Band T2 employs HEB mixers in a waveguide balanced mixer configuration. The entire optics design was driven by the requirement of frequency independent illumination of the secondary with -12 dB edge taper and the limitations imposed by the receiver position in the NCA. The optical system is designed to provide coupling of the SHeFI receiver channels and PI instruments placed in NCA to the common optics of the telescope and cover the wide frequency range from 210 GHz to 1500 GHz. In the paper, the design approach, optimization, and verification are described."
"2008358367","Backward Couplers Waveguide Orthomode Transducer for 84-116 GHz","Alessandro Navarrini and Renzo Nesti","Navarrini",NULL,"12","358","367","2008","We describe the design, construction, and performance of a waveguide Orthomode Transducer (OMT) for the 3 mm band (84-116 GHz.) The OMT is based on a symmetric backward coupling structure and has a square waveguide input port (2.54 mm x 2.54 mm) and two single-mode waveguide outputs: a standard WR10 rectangular waveguide (2.54 mm x 1.27 mm,) and an oval waveguide with full-radius corners. The reverse coupling structure is located in the common square waveguide arm and splits one polarization signal in two opposite rectangular waveguide sidearms using broadband -3 dB E-plane branch-line hybrid couplers. The device was optimized using a commercial 3D electromagnetic simulator. The OMT consists of two mechanical blocks fabricated in split-block configuration using conventional CNC milling machine.
From 84 to 116 GHz the measured input reflection coefficient was less than -17 dB, the isolation between the outputs was less than -50 dB, the cross polarization was less than -30 dB, and the transmission was larger than -0.35 dB at room temperature for both polarization channels. The device is suitable for scaling to higher frequency."
"2008368372","Physical Optics Analysis of the ALMA Band 5 Front End Optics","Mark Whale, Neil Trappe, and Victor Belitsky","Whale",NULL,"12","368","372","2008","The Atacama Large Millimetre Array will be a ground based millimetre to submillimetre band interferometer. The instrument will be comprised of up to 50 high precision 12m Cassegrain antennas. Each antenna will cover a frequency range from 30 to 950 GHz, which will be split into 10 observing channels/bands. Each frequency channel will have its own specifically designed front end optics to couple radiation from the secondary reflector focal plane to the accompanying receiver. We present a full electromagnetic analysis of the band 5 front end optics system using physical optics, which covers a range from 163 to 211 GHz. This band is being developed by the Group for Advanced Receiver Development (GARD) at Chalmers University, Gothenburg, Sweden. Two software packages are utilised for this analysis; the industry standard reflector antenna software package GRASP9 developed by TICRA and a new optical software package MODAL (Maynooth Optical Design Analysis Laboratory) developed at NUI Maynooth, Ireland. Electromagnetic predictions of beam patterns are presented at the Cassegrain focal plane and at the subreflector vertex. The basis of the analysis is primarily to determine optical performance and efficiency and the effects of beam truncation by the off-axis reflectors of the front end optics. Three levels of beam truncation are modelled varying rim diameter."
"2008390396","Dome A, Antarctica: Prospectives for Terahertz Astronomy from the Ground","C.A. Kulesa, C.K. Walker, M. Schein, D. Golish, N. Tothill, P. Siegel, S. Weinreb, G. Jones, J. Bardin, K. Jacobs, C.L. Martin, J. Storey, M. Ashley, J. Lawrence, D. Luong-Van, J. Everett, L. Wang, L. Feng, Z. Zhu, J. Yan, J. Yang, X-G. Zhang, X. Cui, X. Yuan, J. Hu, Z. Xu, Z. Jiang, H. Yang, Y. Li, B. Sun, W. Qin, Z. Shang","Kulesa",NULL,"P1","390","396","2008","Over a decade of site testing and operation of submillimeter telescopes has shown that the high Antarctic Plateau (South Pole) and Chilean Atacama desert (Chajnantor) are exceptional ground-based sites for submillimeter and terahertz astronomy. The highest sites at both locations (Dome A and the Chajnantor and Sairecabur summits) show great promise in yielding even more favorable conditions. To test the conditions at Dome A, we have deployed Pre-HEAT, a 20 cm aperture submillimeter-wave telescope with a 660 GHz (450 micron) Schottky diode heterodyne receiver and digital FFT spectrometer for the Plateau Observatory (PLATO) developed  by the University of New South Wales. In January 2008 it was deployed to Dome A, the summit of the Antarctic plateau, as part of a scientific traverse led by the Polar Research Institute of China. Dome A may be one of the best sites in the world for ground based Terahertz astronomy, based on the exceptionally cold, dry and stable conditions which prevail there. Pre-HEAT is measuring the 450 micron sky opacity at Dome A and mapping the Galactic Plane in the 13CO J=6-5 line, constituting the first submillimeter measurements from Dome A. It is field-testing many of the key technologies for its namesake, a successor mission called HEAT: the High Elevation Antarctic Terahertz telescope. Exciting prospects for submillimeter astronomy from Dome A and the status of Pre-HEAT will be presented."
"2008397000","Progress of Space Terahertz Technology in China","Cunlin Zhang and Guozhong Zhao","Zhang",NULL,"P1","397","0","2008","Terahertz science and technology attract more and more attentions of scientists and techniques in the recent years. The space terahertz technology is becoming into a hot spot in the field of the space research and the space application. We present the progress of space terahertz technology in china in this paper. Except for the exploring the application of terahertz technology on the space positioning, the remote sensing, and the monitoring of cosmic rays, and so on, we are focusing on the application of the new technologies of terahertz imaging on the space technology. Instead of the point-by-point scanning of terahertz imaging, we have developed the two-demission quasi-real time of terahertz imaging technology. The infrared CCD with the operating wavelength of around 800 nm is used for the imaging of terahertz field by the electro-optic sampling. The scope of imaging depends on the size of the electro-optic crystal. The corresponding software is explored based on the LabVIEW programming. The stand-off terahertz imaging by the CCD detection is going on the development based on the cooperation between the Institute of Space Technology of China and the key lab of Terahertz Optoelectronics of Education Committee in the Capital Normal University. We also present the future trend of space technology of china including the terahertz imaging technology. Finally the cooperation between China and Europe is suggested with concerning on the basis of technology cooperation of other field. It is helpful for all us to exchange the idea on the application of terahertz technology on the space research."
"2008398402","Superconducting contacts and NbN HEB mixer performance","Tarun Aggarwal, Pourya Khosropanah, Wen Zhang, Frans D. Tichelaar, Jian-Rong Gao, T.M. Klapwijk","Aggarwal",NULL,"P2","398","402","2008","We demonstrate that the performance of phonon cooled NbN hot electron bolometer mixers depends on the superconducting interlayer between the NbN bridge and the Au antenna. This interlayer is either a superconducting Nb layer or a NbTiN layer. We find that, for given interface cleaning conditions, the mixers with a Nb interlayer show a similar or even a slightly better noise temperature in comparison with the mixers with a NbTiN interlayer. The best receiver noise temperature is 1230 K at 2.5 THz and becomes 980 K corrected for reflection loss due to the use of a Si lens. An important outcome of this study is that the Nb interlayer can lead to excellent performance of HEB mixers. Unlike NbTiN, a Nb sputtering process is widely available and easy to use. In addition, we also inspect the interfaces of the contact structures using HRTEM and find that the interfaces of NbN/Nb and NbN/NbTiN after Ar+ cleaning are excellent."
"2008403408","NbN HEB for THz Radiation: Technological Issues and Proximity Effect","Konstantin S. Il'in, Axel Stockhausen, Michael Siegel, Alexei D. Semenov, Heiko Richter, Heinz-Wilhelm Hübers","Il'in","Huebers, Hubers","P2","403","408","2008","Superconducting phonon-cooled hot-electron bolometer (HEB) detectors are complex multi-layer devices consisting of an ultra-thin superconducting film (mostly NbN) and a thick normal metal layer. We present results on the development of NbN ultra-thin film technology and the systematic study of superconducting and transport properties of NbN bridge-structures with different thickness (4 - 10 nm) and width (0.1 - 10 micron). The NbN films are deposited onto heated Si substrate by magnetron sputtering of Nb target in the reactive gas mixture of argon and nitrogen. A critical temperature of about 9.5 K is reached for NbN films with a thickness between 5 and 6 nm. Twofold increase of the film thickness increases the critical temperature to 12 K. Reducing the bridge width below 0.5 micron leads to a decrease in its critical temperature that is similar to the effect of the film thickness. The model of intrinsic proximity effect in ultra-thin films explains fairly well the degradation of superconductivity in NbN bridges with the decrease of either film thickness or bridge width. Moreover, the proximity effect theory agrees well with experimental data on the critical temperature variations in NbN/Au bi-layers with different thickness of the Au layer. We have shown that an 18 nm thick buffer layer of NbN under much thicker Au layer is sufficient to ensure a bi-layer critical temperature of 8.5 K that is close to the critical temperature of 5 nm thick HEB devices. Presented results demonstrate challenges of further developing HEB detectors for THz spectral range."
"2008409412","Development of 0.8 THz and 1.5 THz Waveguide NbTiN HEB Mixers","L. Jiang, S. Shiba, K. Shimbo, M. Sugimura, P.G. Ananthasubramanian, H. Maezawa, Y. Irimajiri, S.C. Shi, S. Yamamoto","Jiang",NULL,"P2","409","412","2008","In this paper, we present results on the noise performance of the waveguide Niobium Titanium Nitride (NbTiN) superconducting hot electron bolometer (HEB) mixers, cryogenically cooled by a 4-K close-cycled refrigerator. The NbTiN superconducting HEB mixer is fabricated on a crystalline quartz substrate, and is mounted in a waveguide mixer block for RF and LO coupling. At 0.81 THz, the uncorrected DSB receiver noise temperature is measured to be 500 K and the noise bandwidth is 1.4 GHz. The same mixer shows the DSB receiver noise temperature of 640 K at 0.65 THz. We also investigate the DC performance of superconducting NbTiN HEB mixer designed for 1.5 THz."
"2008413415","Development of membrane based NbN-HEBs for submillimeter astrophysical applications","R. Lefèvre, Y. Delorme, A. Féret, F. Dauplay, W. Miao, L. Pelay, B. Lecomte, B. Guillet, G. Beaudin, and J.-M. Krieg","Lefèvre","Lefevre, Feret","P2","413","415","2008","We are developing membrane based NbN hot electron bolometer (HEB) arrays for sub-millimeter astrophysical applications. Here we report in detail on the device fabrication process using a silicon oxide based resist (HSQ). The e-beam patterned HSQ is used as a mask in reactive ion etching for HEB definition and then remains on top of the HEB providing protection against contamination. This process is relatively simple since it requires less steps than previously reported and therefore reduces the risk of degradation of the ultra thin NbN film. To get good quality membranes for THz-HEB applications, different membrane process have been investigated. Electrical characterisations have been performed at room and cryogenic temperatures to compare the quality of the devices with membranes made up of Si/SiO2 or Si3N4/SiO2 and processed with either dry or wet etching methods."
