"fileName","title","authors","firstAuthor","altAuthors","session","firstPage","lastPage","procYear","abstract"
"2008556000","Design and Simulation of a Corrugated Polarizer and Waveguide-based OMT for a 129 GHz VLBI Receiver of KVN","Moon-Hee Chung, Do-Heung Je, Seog-Tae Han, Changhoon Lee, and Duk-Gyoo Roh","Chung",NULL,"P12","556","0","2008","In millimeter-wave VLBI systems, dual-circular polarization observations are generally performed. As the highest frequency band of KVN(Korean VLBI Network), a 129 GHz band receiver is being designed for prototype. To reduce the receiver noise temperature, it is necessary that passive components including polarizer and OMT are inserted into the cryogenically cooled dewar. Traditionally septum polarizers are used at lower frequencies like 22 and 43 GHz bands because of its simplicity. But this type polarizer has relatively narrow bandwidth and is difficult to be fabricated and assembled at higher frequencies. To overcome these drawbacks, corrugated phase shifter or polarizer integrated into waveguide-based OMT is expected to be employed for the 129 GHz VLBI receiver of KVN. Intensive simulations using commercially available tool like CST MWS are being carried out to optimize and predict the performance of the proposed polarizer and OMT. In this paper, the design and theoretically calculated performance of our prototype polarizer and OMT for the 129 GHz band receiver will be presented."
"2008557562","Development of a 385-500 GHz Orthomode Transducer (OMT)","Mamoru Kamikura, Masato Naruse, Shin'ichiro Asayama, Naohisa Satou, Wenlei Shan, and Yutaro Sekimoto","Kamikura",NULL,"P12","557","562","2008","We report on the development of an orthomode transducer (OMT) for ALMA Band 8 (385-500 GHz). The OMT is a scaled model of that of ALMA Band 4 (125-163 GHz), which has a B phi ifot junction and a double ridge. The transmission loss of the OMT at 4 K was derived to be 0.4-0.5 dB from noise measurements with an SIS mixer. The polarization isolation was measured to be larger than 20 dB from quasioptical measurements. For electromagnetic design, effects of mechanical errors have been studied and then a robust design with allowable mechanical errors of 10 micron has been obtained."
"2008563567","Investigation of a 600-GHz Membrane-Based Twin Slot Antenna for HEB Mixers","W. Miao, Y. Delorme, F. Dauplay, R. Lefevre, B. Lecomte, A. Feret, G. Beaudin, J.M. Krieg, W. Zhang, S.H. Cheng, and S.C. Shi","Miao","Féret","P12","563","567","2008","In this paper, a 600-GHz membrane-based twin slot antenna for superconducting HEB (hot-electron-bolometer) mixers was investigated. The simulation on the radiation pattern and return loss (refer to the feed point) of the twin slot antenna including an RF choker filter was performed with Microwave Studio CST, Ansoft HFSS, and EMSS FEKO. An additional parabolic mirror is taken into account as focusing element in the membrane-based design and analyzed by using physical optics ray tracing approximation. We also fabricated a 200-times scale model of the designed twin slot antenna to validate the simulated results. For the scale model measurement, a de-embedding measurement technique was adopted to extract the input impedance of the twin slot antenna. The measured results are found in good agreement with the simulation."
"2008568576","Terahertz Attenuator Based on the Sub-wavelength Metal Structures","Guozhong Zhao, Jie Bai, Yang Wang, and Cunlin Zhang","Zhao",NULL,"P12","568","576","2008","In this paper, we present a THz attenuator based on the sub-wavelength metal structures. The THz attenuator is designed and fabricated on a copper foil. We measured THz transmission of the attenuator by means of terahertz time domain spectroscopy. The experimental results show that the attenuator can have a good frequency selectivity which depends on the polarization of THz radiation. THz power can be attenuated continuously into any level at a certain THz frequency without changing the polarization and coherence of THz beam. Its attenuated frequency is designable by changing the size and shape of metal structures. The frequency selective transmission of the attenuator is determined experimentally. We believe that our results suggest a valuable THz component for THz application, in particular, for THz space instruments."
"2007019024","SOFIA: An Observatory for THz Science and Technology","Eric E. Becklin, Sean C. Casey, and Xander Tielens","Becklin",NULL,"1","19","24","2007","The Stratospheric Observatory for Infrared Astronomy (SOFIA) is the next generation of airborne astronomical observatories. Funded by the U.S. and German space agencies with an expected operational lifetime of 20 years, SOFIA is scheduled for science flights beginning in late-2009. The observatory consists of a 747-SP aircraft modified to accommodate a 2.5-meter infrared telescope within an open port cavity. Academic and government laboratories spanning both the U.S. and Germany are developing science instruments for SOFIA. With an evolving suite of state-of-the-art technologies, SOFIA will explore the emission of astronomical sources with an unprecedented level of angular resolution (Theta[arc-seconds] = 0.1 x wavelength [micron]) and spectral line sensitivity over a core frequency range of 1 - 10 THz (i.e. wavelengths of 30 - 300 microns). On April 26, 2007, the first test flight of the heavily modified SOFIA aircraft was achieved in Waco, Texas. The current status of SOFIA is available from the observatory web site at http://sofia.arc.nasa.gov and is updated frequently."
"2007025031","Spectroscopy with the Herschel Space Observatory","Paul F. Goldsmith","Goldsmith",NULL,"1","25","31","2007","Submillimeter astronomy from space offers many advantages, due to completely avoiding the attenuations and noise from the Earth's atmosphere. For spectroscopy in the 60 to 670 micron range, the Herschel Space Observatory offers important new capabilities in terms of angular resolution, sensitivity, and over much of this range, for high spectral resolution observations. Herschel builds on the success of two earlier space missions devoted to submillimeter spectroscopy: SWAS and Odin. In this paper, I briefly highlight the results from those missions. I then discuss the capabilities of the three instruments on the Herschel Space Observatory, known by their acronyms HIFI, SPIRE, and PACS, focusing on spectroscopic observations. I conclude with a short summary of some of the astrophysical highlights that may be anticipated when Herschel is operational, which should be about 6 months after launch, currently scheduled for September 2008."
"2007032037","The Cornell Caltech Atacama Telescope","Simon J. E. Radford, Riccardo Giovanelli, Thomas A. Sebring, Jonas Zmuidzinas","Radford",NULL,"1","32","37","2007","Cornell University, the California Institute for Technology, and the Jet Propulsion Laboratory are jointly studying the construction of a 25 m diameter telescope for submillimeter astronomy on a high mountain in northern Chile. This Cornell Caltech Atacama Telescope (CCAT) will combine high sensitivity, a wide field of view, and a broad wavelength range to provide an unprecedented capability for deep, large area, multi-color submillimeter surveys to complement narrow field, high resolution studies with ALMA. CCAT observations will address fundamental themes in contemporary astronomy, notably the formation and evolution of galaxies, the nature of the dark matter and dark energy that comprise most of the content of the universe, the formation of stars and planets, the conditions in circumstellar disks, and the conditions during the early history of the Solar system. The candidate CCAT site, at 5600 m in northern Chile, enjoys superb observing conditions. To accommodate large format bolometer cameras, CCAT is designed with a 20 arcmin field of view. CCAT will incorporate closed loop active control of its segmented primary mirror to maintain a half wavefront error of 10 micron rms or less. Instrumentation under consideration includes both short (650 micron-200 micron) and long (2 mm-750 micron) wavelength bolometer cameras, direct detection spectrometers, and heterodyne receiver arrays. The University of Colorado, a Canadian university consortium, and the UK Astronomy Technology Centre on behalf of the UK community are pursuing participation in the CCAT consortium. When complete early in the next decade, CCAT will be the largest and most sensitive facility of its class as well as the highest altitude astronomical facility on Earth."
"2007038000","The Submillimeter Array","Raymond Blundell","Blundell",NULL,"1","38","0","2007","The Submillimeter Array, a collaborative effort between the Smithsonian Institution and the Academia Sinica Institute of Astronomy and Astrophysics, was largely completed by November 2003, when scheduled science observations began. At that time the array consisted of eight six-meter diameter antennas equipped with receivers designed to operate in the atmospheric windows around 230, 345 and 650 GHz. During the past three years a number of improvements and upgrades have been made to the array which now performs nightly astronomical observations on a routine basis. These upgrades will be discussed as well as plans for short-term improvements."
"2007039043","Construction of a Side-Band-Separating Heterodyne Mixer for Band 9 of ALMA","F.P. Mena, J. Kooi, A.M. Baryshev, C.F.J. Lodewijk, T.M. Klapwijk, R. Hesper, and W. Wild","Mena",NULL,"2","39","43","2007","In this article we present the design, modeling and construction of a side-band-separating (2SB) heterodyne receiver for the frequency range from 600 to 720 GHz that corresponds to band 9 band of ALMA. The characteristics of this receiver present a significant improvement over the current double-sideband (DSB) configuration currently under development. The core of the mixer consists of a quadrature hybrid, two LO injectors, two superconductor-insulator-superconductor (SIS) junctions, three signal-termination loads, and two IF filtering systems. All these parts were modeled and optimized prior construction. Our 2 mixer exploits waveguide technology and has been constructed in the split-block technique. We used state-of-the-art CNC micromachining which permitted us to obtain the small dimensions required for this frequency range. The constructed receiver presents a good performance but we suggest various ideas for further improvement."
"2007044049","SIS Mixer for 385 - 500 GHz with On-Chip LO injection","Raquel Monje, Victor Belitsky, Christophe Risacher, Vessen Vassilev and Alexey Pavolotsky","Monje",NULL,"2","44","49","2007","We present the design and first experimental results of a 385-500 GHz fixed-tuned double sideband (DSB) receiver based on a superconductor-insulator-superconductor (SIS) junction mixer with on-chip LO injection circuitry. At high frequency, branch waveguide couplers are difficult to manufacture with required accuracy as the branches (slots) become extremely narrow. In order to solve this problem, we propose a coupler integrated onto the mixer chip and fabricated together with the SIS junction and the tuning circuitry. The on-chip LO directional coupler is made of superconducting lines with slot lines in the ground plane. Thus, the coupler is integrated into conventional SIS junction fabrication steps, benefiting from the processing accuracy better than 0.5 micron by using optical lithography only. Furthermore, the mixer design includes a novel component, an ellipse termination for the idle LO port, made of thin-film resistive material. This termination gives very broadband performance using a compact area. Moreover, it is very tolerant to the sheet resistivity of the film, geometry and does not require any physical grounding. The mixer is to be used at the Atacama Pathfinder EXperiment (APEX) telescope in Chile."
"2007050053","Development of 1 THz SIS mixer for SOFIA","A. Karpov, D. Miller, J. A. Stern, B. Bumble, H. G. LeDuc, J. Zmuidzinas","Karpov",NULL,"2","50","53","2007","We report the development of a low noise and broadband SIS mixer aimed for 1 THz channel of the Caltech Airborne Submillimeter Interstellar Medium Investigations Receiver (CASIMIR), designed for the Stratospheric Observatory for Far Infrared Astronomy, (SOFIA). In the SIS mixer are used the Nb/AlN/NbTiN junctions with the Josephson critical current density of about 40 KA/cm 2. The mixer is built using a double-slot quasi-optical design and covers a 250 GHz band centered at 1 THz. The minimum measured receiver noise is about 353 K (Y=1.50). The receiver noise may be reduced using a higher level of LO power. The developed mixer will allow building a receiver with the noise temperature approaching 250 K in 1 THz band and having a broader operation band compared to the previously reported."
"2007054059","Performance and modeling of 700 GHz SIS finline mixers","Paul K. Grimes, Ghassan Yassin, Stafford Withington, and Karl Jacobs","Grimes",NULL,"2","54","59","2007","SIS mixers using finline waveguide to microstrip transitions show a number of advantageous features, particularly in providing a broadband, fixed impedance feed to the SIS mixer tuning circuit. The large chip area and insensitivity to mixer block machining tolerances simplifies the assembly of the mixer, as well as allowing more advanced mixer designs to be fabricated on a single chip. Finline SIS mixers have shown good performance in the 230 and 350 GHz bands, and we have also previously reported results from two finline SIS mixers in the 600-720 GHz band, obtaining best receiver noise temperatures of ~250 K. In this paper we present results from several finline mixers in the 600-720 GHz band, using both variants of our original 3-stage Chebyshev filter tuned single junction mixers and new Belitsky tuned mixers. These dual junction tuned mixers show significantly better performance than our previously reported results, with receiver noise temperatures below 200 K. We present detailed SuperMix simulations of the receiver performance and compare these with measured results. We find good agreement between simulations and measured performance can be achieved by introducing a small amount of attenuation in the RF circuit of the mixer. We also present simulations of the IF bandwidth of finline mixers, and suggest a method by which this can be greatly improved."
"2007060065","Tolerance Analysis of THz-Range Lens-Antenna and Balanced SIS Mixers","Andrey V. Uvarov, Sergey V. Shitov, Oleg V. Koryukin, Maksim A. Bukovski, Yoshinori Uzawa, Takashi Noguchi, Matthias Kroug, Masanori Takeda, Zhen Wang and A. N. Vystavkin","Uvarov",NULL,"2","60","65","2007","Effects caused by imperfection of extended hemispherical immersion lens-antenna are studied numerically at 865 GHz. Elliptical and aplanatic focusing regimes are tested in combination with double-slot and double-dipole feeds for their aperture efficiency in the presence of multiple misalignment factors, which include possible phase and amplitude asymmetry of complimentary SIS tuning circuit. A new balanced lens-antenna SIS mixer is analyzed for its aperture efficiency with respect to an IF bandwidth of 4-12 GHz. Experimental data on lens-antenna SIS mixers with epitaxial NbN-AlN-NbN tunnel junctions is presented."
"2007066000","Development of Multiplier Based Sources for Frequencies up to 2 THz","T.W. Crowe, D.W. Porterfield, J.L. Hesler, W.L. Bishop, G.S. Schoenthal, D.S. Kurtz and K. Hui","Crowe",NULL,"3","66","0","2007","A primary challenge in creating the next generation of submillimeter-wave receiver systems for space science is generating the required local oscillator power. Broad-band performance and power levels suitable for array receivers are required. Also, the sources must be suitable for use at remote installations. This means they should be compact, reliable, electronically tunable and maintenance free. This talk will focus on our continuing development of terahertz sources with emphasis of \"turn-key\" operation, enhanced tuning bandwidth and output frequency to 1.9 THz. Virginia Diodes has developed a series of broadband frequency multipliers based on integrated diode circuits. A tripler to the WR0.5 waveguide band has recently been demonstrated. An amplifier/multiplier chain with this component, shown in Fig. 1, generates 1 - 3 uW of power at room temperature within the 1.8 - 1.9 THz band. Most importantly, it is extremely easy to use and requires no mechanical tuning or user controlled bias adjustments."
"2007067000","A 780-950GHz Frequency Tripler for Radio Astronomy","Alain Maestrini, Charlotte Tripon-Canseliet, John S. Ward, John J. Gill, Erich Schlecht, Goutam Chattopadhyay, and Imran Mehdi","Maestrini",NULL,"3","67","0","2007","We report on the design and fabrication of a fix-tuned wide bandwidth balanced frequency tripler working in the 780-950 GHz band. The multiplier features four GaAs Schottky planar anodes in a balanced configuration integrated on a few micron thick membrane. The multiplier is bias-able and is designed for 15 mW of input power. However, for the preliminary RF tests presented in this paper, the 780-950 GHz tripler was pumped by a chain of two cascaded fixed-tuned balanced doublers able to deliver 4-10.5 mW in the band 273-320 GHz when pumped by a 120-150 mW solid-state source. Due to the limited bandwidth of the driver chain, only tests at frequencies above 820 GHz have been performed. A dual-chip version of the wideband six-anode 260-340GHz frequency tripler presented in is currently in the process of being fabricated and should replace soon the current driver. Room temperature measurements show a conversion efficiency above 1% across the 820-950 GHz band with a peak conversion efficiency of 3.6% at 820 GHz. The output power is above 100 microW from 820 GHz to 935 GHz and falls to 40microW at 950 GHz with a maximum of 325 microW of output power at 852 GHz. Predictions are in close agreement with these measurements, thus, the multiplier is expected to cover frequencies below 820 GHz (which is actually the peak efficiency) down to 870 GHz once a broader-band driver is assembled. During the measurements all the bias voltage of all three multipliers were kept constant therefore the local oscillator chain was very easy to operate (it was fix-tuned and fix-biased)."
"2007068073","Maximizing SNR in LO Chains for ALMA Single-Ended Mixers","Eric W. Bryerton, Matthew A. Morgan, Dorsey L. Thacker and Kamaljeet S. Saini","Bryerton",NULL,"3","68","73","2007","This paper describes the design methodology used to develop local oscillators for the ultra-sensitive single-ended sub-millimeter wave mixers used in ALMA. Recent results of the ALMA LO system are presented, showing little or no noise added to the  receiver. Measurements of excess amplitude noise from ALMA LO prototypes in the development phase are also shown. A design methodology is presented for suppressing amplitude noise in LO chains, using examples from different ALMA bands. We conclude with recommendations for future sub-millimeter LO systems."
"2007074000","Beam patterns of distributed feedback surface-plasmon THz quantum cascade lasers","J.N. Hovenier, S. Paprotskiy, J.R. Gao1, P. Khosropana, T.M. Klapwijk, L. Ajili, M. A. Ines, and J. Faist","Hovenier",NULL,"3","74","0","2007","THz quantum cascade lasers (QCLs) become the choice of solid-state local oscillators (LO) beyond 2 THz because of their frequency coverage, compactness, high power efficiency, and narrow linewidth. They have been successfully demonstrated as LO in laboratory's tests using a hot/cold load. Until now only QCLs based on Fabry-Perot cavity have been investigated as LO, including their beam patterns. However, to perform a spectroscopic measurement, QCLs with a stable single-mode emission at a precisely designed wavelength are desirable. For this purpose, a distributed feedback (DFB) structure, which is based on the first order Bragg gratings incorporated into the waveguide, needs to be introduced into QCLs. Here we report the first beam pattern measurements of 3.4 THz DFB surface plasmon QCLs. The beam patterns are known to be crucial for coupling the radiation to a mixer. The QCLs used are developed by University of Neuchatel. The active region is based on a bound-to-continuum design, while the DFB structure is based on strongly coupled surface grating fabricated with wet etching and metal coverage. Two QCLs with ridge widths of 100 micron or 200 micron have been studied and both lase in single-mode at 3.4 THz. To measure the far-field beam patterns, we use a similar setup as for the metal-metal waveguide QCLs3, but with a reduced surface area of the pyroelectric detector to improve the angular resolution. We found that the beams follow nearly the diffraction limit, if measured with a poor angular resolution and a coarse scanning. However, we observed the interference patterns, characterized by a strong modulation in the intensity with a (intensity) minimum in the pointing direction of the laser, if measured with a relatively high angular resolution and a fine scanning. We also notice that the interference patterns behave in a very much different way as in metal-metal waveguide QCLs3,4, suggesting a different physical origin. Such beam patterns make heterodyne mixing using the DFB QCLs and an NbN HEB mixer extremely challenging."
"2007075080","Development and Design of a 340 GHz Photomixer Source","Biddut Banik, Josip Vukusic, Syed Mahmudur Rahman, Henrik Sunnerud, and Jan Stake","Banik",NULL,"3","75","80","2007","We present the design of an InGaAlAs/InP unitraveling-carrier photo-diode (UTC-PD) at mm-wave frequencies up to 340 GHz. The photo diode epitaxy is optimized using a quasi-3D software implementing the hydrodynamic semiconductor equations, for which an output power of 3 mW at 340 GHz was simulated. An equivalent circuit of the UTC-PD has been fitted to experimental S11 measurements up to 67 GHz. Finally, an optimized antenna coupled UTC-PD with choke filter has been designed. This MMIC circuit is intended for photomixing, with output power at 340 GHz."
"2007081000","Noise and responsivity measurements in Hot-Electron Direct Detectors","Boris Karasik, David Olaya, Jian Wei, Sergey Pereverzev, Michael Gershenson, Jonathan Kawamura, William McGrath, and Andrei Sergeev","Karasik",NULL,"4","81","0","2007","We present the current progress and the test results for the hot-electron transition-edge devices of nanoscale size operating at ~ 0.1-0.4 K. The ultimate goal of this work is to develop a submillimeter Hot-Electron Direct Detector with the noise equivalent power NEP = 10-18-10-20 W/Hz1/2 operated at ~ 0.3 K for the moderate resolution spectroscopy and CMB studies on future space telescope (e.g., SAFIR, SPECS, SPICA, CMBPol) with cryogenically cooled (~ 4-5 K) mirrors. Using the shadow mask evaporation technique we fabricated nanoscale Ti bridges with Nb Andreev contacts. The devices were fabricated on a Si wafer and did not rely on the thermal insulation due to the membrane support normally required in conventional bolometers. The thermal conductance in our devices is set by the electron-phonon coupling, which is very weak in disordered metals at subKelvin temperatures. From the electrical measurements, the thermal conductance was found to be ~ 2 fW/K at 300 mK and ~ 0.1 fW/K at 40 mK. If the thermal fluctuation noise is dominant in the devices then such a uniquely low thermal conductance should provide the NEP required for most demanding applications. The measurements involving detection of single NIR photons (Lambda = 1550 nm) allowed for determination of the bolometer thermal time constant (electron-phonon relaxation time) being of 20 microseconds at 200 mK and a few microseconds at 370 mK. The latter measurements were hindered by the limited SQUID bandwidth (100 kHz). A broadband 1 MHz SQUID is being set up for future experiments on single photon detection. The output electrical noise measured in the devices in the voltage-bias mode was dominated by the thermal energy fluctuations (phonon noise). This was an indication that the responsivity was sufficiently high (i.e., the superconducting transition was steep enough). The very low NEP and the high speed are a unique combination not found in other detectors. This would allow for a very high data rate in an application, though more work is needed to develop an adequate read-out/multiplexing electronics for this type of detector. Beside the extremely low phonon-noise NEP, the nanobolometers have a very low electron heat capacitance. This makes them promising as detectors of single FIR photons for the moderate resolution spectroscopy above 1 THz where the background photon arrival rate is less than the detector speed."
